{
  "id": "llama-cpp-python",
  "name": "llama-cpp-python",
  "description": "A Python binding for llama.cpp with support for OpenAI API compatibility and easy integration with Python projects.",
  "description_fr": "Un binding Python pour llama.cpp avec support pour la compatibilité API OpenAI et une intégration facile avec les projets Python.",
  "best_for": "Python integration for llama.cpp",
  "best_for_fr": "Intégration Python pour llama.cpp",
  "category": "local-runtime",
  "free_type": "open-source",
  "access": "local",
  "difficulty": "intermediate",
  "platforms": ["windows", "macos", "linux"],
  "homepage": "https://github.com/abetlen/llama-cpp-python",
  "account_required": false,
  "card_required": false,
  "commercial_use": "yes",
  "privacy": "local",
  "license": "MIT",
  "limits": "Performance depends on hardware and model selection.",
  "limits_fr": "Les performances dépendent du matériel et de la sélection du modèle.",
  "caveats": ["Requires compilation.", "Model quality varies by size."],
  "caveats_fr": ["Nécessite une compilation.", "La qualité du modèle varie selon la taille."],
  "tags": ["llm", "local", "python", "llama"],
  "source": {"url": "https://github.com/abetlen/llama-cpp-python", "type": "official-repository", "official": true},
  "last_verified": "2026-08-04",
  "status": "active",
  "confidence": "high"
}