{
  "id": "open-webui",
  "name": "Open WebUI",
  "description": "A self-hosted chat and AI platform that can work offline with Ollama and OpenAI-compatible providers, including user management and RAG features.",
  "description_fr": "Une plateforme de clavardage IA auto-hébergée pouvant fonctionner hors ligne avec Ollama et les fournisseurs compatibles OpenAI, avec utilisateurs et RAG.",
  "best_for": "A polished shared interface for local models",
  "best_for_fr": "Une interface soignée et partageable pour les modèles locaux",
  "category": "interface",
  "free_type": "open-source",
  "access": "hybrid",
  "difficulty": "intermediate",
  "platforms": ["docker", "windows", "macos", "linux"],
  "homepage": "https://github.com/open-webui/open-webui",
  "account_required": false,
  "card_required": false,
  "commercial_use": "depends",
  "privacy": "configurable",
  "license": "Open WebUI License",
  "limits": "Self-hosted use is hardware-limited; cloud providers connected to it may charge separately or process submitted data.",
  "limits_fr": "L’auto-hébergement est limité par le matériel; les fournisseurs cloud connectés peuvent facturer séparément ou traiter les données envoyées.",
  "caveats": ["Current releases include a branding-protection clause; read the full license before rebranding or redistribution.", "Installing third-party tools or functions expands the security boundary."],
  "caveats_fr": ["Les versions actuelles incluent une clause de protection de la marque; lisez la licence avant toute redistribution ou modification de marque.", "Les outils et fonctions tiers élargissent le périmètre de sécurité."],
  "tags": ["chat", "self-hosted", "ollama", "rag"],
  "source": {"url": "https://github.com/open-webui/open-webui/blob/main/LICENSE", "type": "official-repository", "official": true},
  "last_verified": "2026-08-04",
  "status": "watch",
  "confidence": "high"
}
