{
  "id": "playht",
  "name": "PlayHT",
  "description": "A free tier text-to-speech service with high-quality voice synthesis and support for multiple languages and voice cloning.",
  "description_fr": "Un service de synthèse vocale gratuit avec une synthèse de voix de haute qualité et support pour plusieurs langues et le clonage de voix.",
  "best_for": "Text-to-speech with voice cloning",
  "best_for_fr": "Synthèse vocale avec clonage de voix",
  "category": "speech",
  "free_type": "free-tier",
  "access": "cloud",
  "difficulty": "beginner",
  "platforms": ["windows", "macos", "linux"],
  "homepage": "https://play.ht",
  "account_required": true,
  "card_required": false,
  "commercial_use": "check-license",
  "privacy": "provider-processed",
  "license": "proprietary",
  "limits": "Free tier limited to 12,500 characters per month; paid plans available.",
  "limits_fr": "Le tier gratuit est limité à 12 500 caractères par mois; des plans payants disponibles.",
  "caveats": ["Requires account for access.", "Free tier has character limits."],
  "caveats_fr": ["Nécessite un compte pour l'accès.", "Le tier gratuit a des limites de caractères."],
  "tags": ["speech", "tts", "voice-cloning", "cloud"],
  "source": {"url": "https://play.ht", "type": "official-docs", "official": true},
  "last_verified": "2026-08-04",
  "status": "active",
  "confidence": "high"
}