{
  "id": "edge-tts",
  "name": "Edge TTS",
  "description": "A free text-to-speech service using Microsoft Edge's online TTS API with support for multiple voices and languages.",
  "description_fr": "Un service gratuit de synthèse vocale utilisant l'API TTS en ligne de Microsoft Edge avec support pour plusieurs voix et langues.",
  "best_for": "Free text-to-speech with natural voices",
  "best_for_fr": "Synthèse vocale gratuite avec des voix naturelles",
  "category": "speech",
  "free_type": "free-tier",
  "access": "cloud",
  "difficulty": "beginner",
  "platforms": [
    "windows",
    "macos",
    "linux"
  ],
  "homepage": "https://github.com/rany2/edge-tts",
  "account_required": false,
  "card_required": false,
  "commercial_use": "check-license",
  "privacy": "provider-processed",
  "license": "GPL-3.0",
  "limits": "Limited to available Microsoft Edge voices; requires internet connection.",
  "limits_fr": "Limité aux voix Microsoft Edge disponibles; nécessite une connexion Internet.",
  "caveats": [
    "Requires internet connection.",
    "Voices are limited to Microsoft Edge's selection."
  ],
  "caveats_fr": [
    "Nécessite une connexion Internet.",
    "Les voix sont limitées à la sélection de Microsoft Edge."
  ],
  "tags": [
    "speech",
    "tts",
    "microsoft",
    "free"
  ],
  "source": {
    "url": "https://github.com/rany2/edge-tts",
    "type": "official-repository",
    "official": true
  },
  "last_verified": "2026-09-26",
  "status": "active",
  "confidence": "high"
}
