{
  "id": "openhands",
  "name": "OpenHands",
  "description": "An open-source AI-powered software development agent that can write code, fix bugs, and contribute to projects autonomously.",
  "description_fr": "Un agent de développement logiciel IA open source qui peut écrire du code, corriger des bugs et contribuer aux projets de manière autonome.",
  "best_for": "Autonomous AI software development agent",
  "best_for_fr": "Agent de développement logiciel IA autonome",
  "category": "coding",
  "free_type": "open-source",
  "access": "local",
  "difficulty": "advanced",
  "platforms": ["linux", "docker"],
  "homepage": "https://github.com/All-Hands-AI/OpenHands",
  "account_required": false,
  "card_required": false,
  "commercial_use": "yes",
  "privacy": "local",
  "license": "MIT",
  "limits": "Performance depends on hardware and selected LLM provider.",
  "limits_fr": "Les performances dépendent du matériel et du fournisseur LLM sélectionné.",
  "caveats": ["Requires API keys for external LLM providers.", "Autonomous coding requires careful monitoring."],
  "caveats_fr": ["Nécessite des clés API pour les fournisseurs LLM externes.", "Le codage autonome nécessite une surveillance attentive."],
  "tags": ["coding", "autonomous", "agent", "software-development"],
  "source": {"url": "https://github.com/All-Hands-AI/OpenHands", "type": "official-repository", "official": true},
  "last_verified": "2026-08-04",
  "status": "active",
  "confidence": "high"
}