{
  "id": "diffusers",
  "name": "Diffusers",
  "description": "A state-of-the-art library for diffusion model inference and training with support for Stable Diffusion, DALL-E, and other generative models.",
  "description_fr": "Une bibliothèque de pointe pour l'inférence et l'entraînement de modèles de diffusion avec support pour Stable Diffusion, DALL-E et autres modèles génératifs.",
  "best_for": "Running and training diffusion models for image generation",
  "best_for_fr": "Exécuter et entraîner des modèles de diffusion pour la génération d'images",
  "category": "image-generation",
  "free_type": "open-source",
  "access": "local",
  "difficulty": "intermediate",
  "platforms": ["windows", "macos", "linux"],
  "homepage": "https://github.com/huggingface/diffusers",
  "account_required": false,
  "card_required": false,
  "commercial_use": "yes",
  "privacy": "local",
  "license": "Apache-2.0",
  "limits": "Performance depends on GPU; model licenses vary.",
  "limits_fr": "Les performances dépendent du GPU; les licences des modèles varient.",
  "caveats": ["Requires GPU for practical use.", "Model licenses vary by model."],
  "caveats_fr": ["Nécessite un GPU pour un usage pratique.", "Les licences des modèles varient selon le modèle."],
  "tags": ["diffusion", "image-generation", "stable-diffusion", "generative"],
  "source": {"url": "https://github.com/huggingface/diffusers", "type": "official-repository", "official": true},
  "last_verified": "2026-08-04",
  "status": "active",
  "confidence": "high"
}