{
  "id": "lm-studio",
  "name": "LM Studio",
  "description": "A desktop application for running local LLMs with a user-friendly interface and support for multiple model formats.",
  "description_fr": "Une application de bureau pour exécuter des LLMs locaux avec une interface conviviale et support pour plusieurs formats de modèles.",
  "best_for": "Easy local LLM hosting",
  "best_for_fr": "Hébergement LLM local facile",
  "category": "local-runtime",
  "free_type": "free-tier",
  "access": "local",
  "difficulty": "beginner",
  "platforms": [
    "windows",
    "macos",
    "linux"
  ],
  "homepage": "https://lmstudio.ai",
  "account_required": false,
  "card_required": false,
  "commercial_use": "check-license",
  "privacy": "local",
  "license": "proprietary",
  "limits": "Free for personal use; commercial license required for business use.",
  "limits_fr": "Gratuit pour usage personnel; licence commerciale requise pour usage professionnel.",
  "caveats": [
    "Commercial use requires license.",
    "Limited model customization."
  ],
  "caveats_fr": [
    "L'usage commercial nécessite une licence.",
    "Personnalisation des modèles limitée."
  ],
  "tags": [
    "local",
    "llm",
    "desktop",
    "user-friendly"
  ],
  "source": {
    "url": "https://lmstudio.ai",
    "type": "official-docs",
    "official": true
  },
  "last_verified": "2026-09-26",
  "status": "active",
  "confidence": "high"
}
