{
  "id": "llama-cpp",
  "name": "llama.cpp",
  "description": "A dependency-light C and C++ inference engine for GGUF language models with CPU, GPU, hybrid offload, quantization, and an OpenAI-compatible server.",
  "description_fr": "Un moteur d’inférence C et C++ léger pour modèles GGUF avec CPU, GPU, déchargement hybride, quantification et serveur compatible OpenAI.",
  "best_for": "Maximum control and broad hardware support",
  "best_for_fr": "Un contrôle maximal et une vaste compatibilité matérielle",
  "category": "local-runtime",
  "free_type": "open-source",
  "access": "local",
  "difficulty": "advanced",
  "platforms": ["windows", "macos", "linux"],
  "homepage": "https://github.com/ggml-org/llama.cpp",
  "account_required": false,
  "card_required": false,
  "commercial_use": "yes",
  "privacy": "local",
  "license": "MIT",
  "limits": "Performance and maximum model size depend on CPU features, RAM, GPU backend, VRAM, and quantization.",
  "limits_fr": "Les performances et la taille maximale du modèle dépendent du CPU, de la RAM, du moteur GPU, de la VRAM et de la quantification.",
  "caveats": ["Model files have independent licenses and may impose additional restrictions."],
  "caveats_fr": ["Les fichiers de modèles ont des licences indépendantes qui peuvent imposer d’autres restrictions."],
  "tags": ["llm", "gguf", "quantization", "server"],
  "source": {"url": "https://github.com/ggml-org/llama.cpp", "type": "official-repository", "official": true},
  "last_verified": "2026-08-04",
  "status": "active",
  "confidence": "high"
}
