{
  "id": "groq-api",
  "name": "Groq API Free Plan",
  "description": "A hosted inference API focused on fast responses, with model-specific free-plan request and token limits published in the official console documentation.",
  "description_fr": "Une API d’inférence hébergée axée sur la rapidité, avec des limites gratuites de requêtes et de jetons propres à chaque modèle dans la documentation officielle.",
  "best_for": "Fast experimentation with supported open models",
  "best_for_fr": "Expérimenter rapidement avec les modèles ouverts pris en charge",
  "category": "api",
  "free_type": "free-tier",
  "access": "cloud",
  "difficulty": "intermediate",
  "platforms": [
    "web",
    "windows",
    "macos",
    "linux"
  ],
  "homepage": "https://console.groq.com/",
  "account_required": true,
  "card_required": false,
  "commercial_use": "depends",
  "privacy": "provider-processed",
  "license": null,
  "limits": "Limits are applied at organization level and vary by model across requests per minute/day and tokens per minute/day.",
  "limits_fr": "Les limites s’appliquent à l’organisation et varient par modèle selon les requêtes et jetons par minute ou par jour.",
  "caveats": [
    "Exact limits shown in the account can differ from the public summary and may change."
  ],
  "caveats_fr": [
    "Les limites exactes du compte peuvent différer du résumé public et être modifiées."
  ],
  "tags": [
    "api",
    "fast-inference",
    "open-models",
    "developer"
  ],
  "source": {
    "url": "https://console.groq.com/docs/rate-limits",
    "type": "official-docs",
    "official": true
  },
  "last_verified": "2026-09-26",
  "status": "active",
  "confidence": "high"
}
