{
  "id": "jax",
  "name": "JAX",
  "description": "An open-source numerical-computing library that adds automatic differentiation, vectorization, compilation, and accelerator execution to NumPy-style Python programs.",
  "description_fr": "Une bibliothèque open source de calcul numérique ajoutant différentiation automatique, vectorisation, compilation et accélérateurs aux programmes Python de style NumPy.",
  "best_for": "High-performance ML research and numerical computing",
  "best_for_fr": "La recherche ML haute performance et le calcul numérique",
  "category": "ml-framework",
  "free_type": "open-source",
  "access": "local",
  "difficulty": "advanced",
  "platforms": ["macos", "linux"],
  "homepage": "https://github.com/jax-ml/jax",
  "account_required": false,
  "card_required": false,
  "commercial_use": "yes",
  "privacy": "local",
  "license": "Apache-2.0",
  "limits": "Performance and supported features depend on the operating system, accelerator backend, drivers, memory, and compiled workload.",
  "limits_fr": "Les performances et fonctions dépendent du système, du backend accélérateur, des pilotes, de la mémoire et de la charge compilée.",
  "caveats": ["Accelerator installation varies by platform.", "JAX is a numerical foundation rather than a complete end-user AI application."],
  "caveats_fr": ["L’installation des accélérateurs varie selon la plateforme.", "JAX est une fondation numérique, pas une application IA complète."],
  "tags": ["training", "research", "gpu", "python"],
  "source": {"url": "https://github.com/jax-ml/jax", "type": "official-repository", "official": true},
  "last_verified": "2026-08-04",
  "status": "active",
  "confidence": "high"
}
