{
  "id": "bentoml",
  "name": "BentoML",
  "description": "An open-source framework for building, shipping, and scaling production-ready AI applications with support for any ML framework.",
  "description_fr": "Un framework open source pour construire, déployer et scaler des applications IA prêtes pour la production avec support pour tout framework ML.",
  "best_for": "Building and deploying production ML services",
  "best_for_fr": "Construire et déployer des services ML en production",
  "category": "ml-framework",
  "free_type": "open-source",
  "access": "local",
  "difficulty": "intermediate",
  "platforms": ["linux", "docker"],
  "homepage": "https://github.com/bentoml/BentoML",
  "account_required": false,
  "card_required": false,
  "commercial_use": "yes",
  "privacy": "local",
  "license": "Apache-2.0",
  "limits": "The framework is free; BentoCloud has separate pricing.",
  "limits_fr": "Le framework est gratuit; BentoCloud a une tarification séparée.",
  "caveats": ["Complex setup for production use.", "Cloud services have separate pricing."],
  "caveats_fr": ["Configuration complexe pour un usage en production.", "Les services cloud ont une tarification séparée."],
  "tags": ["ml", "deployment", "production", "serving"],
  "source": {"url": "https://github.com/bentoml/BentoML", "type": "official-repository", "official": true},
  "last_verified": "2026-08-04",
  "status": "active",
  "confidence": "high"
}