{
  "id": "gpt4all",
  "name": "GPT4All",
  "description": "An open-source desktop and developer ecosystem for running compatible language models locally, including chat, document use, model downloads, and local APIs.",
  "description_fr": "Un écosystème open source de bureau et de développement pour exécuter des modèles compatibles localement, avec chat, documents, téléchargements et API locales.",
  "best_for": "A desktop-first local LLM experience",
  "best_for_fr": "Une expérience LLM locale centrée sur le bureau",
  "category": "local-runtime",
  "free_type": "open-source",
  "access": "local",
  "difficulty": "beginner",
  "platforms": ["windows", "macos", "linux"],
  "homepage": "https://github.com/nomic-ai/gpt4all",
  "account_required": false,
  "card_required": false,
  "commercial_use": "check-license",
  "privacy": "local",
  "license": "MIT",
  "limits": "Speed, context, and model size depend on CPU, RAM, storage, and the license attached to each downloaded model.",
  "limits_fr": "La vitesse, le contexte et la taille dépendent du CPU, de la RAM, du stockage et de la licence de chaque modèle téléchargé.",
  "caveats": ["The application license does not replace model licenses.", "Repository activity and supported models should be checked before standardizing a workflow."],
  "caveats_fr": ["La licence de l’application ne remplace pas celles des modèles.", "Vérifiez l’activité du dépôt et les modèles pris en charge avant de standardiser un flux."],
  "tags": ["local", "desktop", "llm", "documents"],
  "source": {"url": "https://github.com/nomic-ai/gpt4all", "type": "official-repository", "official": true},
  "last_verified": "2026-08-04",
  "status": "watch",
  "confidence": "high"
}
