{
  "id": "microsoft-ai-for-beginners",
  "name": "Microsoft AI for Beginners",
  "description": "A free open-source curriculum organized into twelve weeks and twenty-four lessons covering classical AI concepts, neural networks, computer vision, NLP, ethics, and hands-on labs.",
  "description_fr": "Un programme gratuit et open source de douze semaines et vingt-quatre leçons couvrant IA classique, réseaux neuronaux, vision, NLP, éthique et laboratoires pratiques.",
  "best_for": "A structured introduction to broad AI foundations",
  "best_for_fr": "Une introduction structurée aux fondations générales de l’IA",
  "category": "learning",
  "free_type": "open-source",
  "access": "cloud",
  "difficulty": "beginner",
  "platforms": ["web", "windows", "macos", "linux"],
  "homepage": "https://github.com/microsoft/AI-For-Beginners",
  "account_required": false,
  "card_required": false,
  "commercial_use": "yes",
  "privacy": "local",
  "license": "MIT",
  "limits": "Course material is free; some labs require local setup, packages, compute, or optional external services.",
  "limits_fr": "Le cours est gratuit; certains laboratoires exigent une installation locale, des paquets, du calcul ou des services externes facultatifs.",
  "caveats": ["Software versions can change after a lesson is published.", "Learning outcomes require completing the exercises."],
  "caveats_fr": ["Les versions logicielles peuvent évoluer après publication d’une leçon.", "Les résultats d’apprentissage exigent de faire les exercices."],
  "tags": ["course", "beginner", "foundations", "curriculum"],
  "source": {"url": "https://github.com/microsoft/AI-For-Beginners", "type": "official-repository", "official": true},
  "last_verified": "2026-08-04",
  "status": "active",
  "confidence": "high"
}
