{
  "id": "comfyui",
  "name": "ComfyUI",
  "description": "A powerful and modular node-based UI for Stable Diffusion with support for complex workflows and custom nodes.",
  "description_fr": "Une interface utilisateur modulaire et puissante basée sur des nœuds pour Stable Diffusion avec support pour les flux de travail complexes et les nœuds personnalisés.",
  "best_for": "Advanced image generation workflows",
  "best_for_fr": "Flux de travail de génération d'images avancés",
  "category": "image-generation",
  "free_type": "open-source",
  "access": "local",
  "difficulty": "intermediate",
  "platforms": ["windows", "macos", "linux"],
  "homepage": "https://github.com/comfyanonymous/ComfyUI",
  "account_required": false,
  "card_required": false,
  "commercial_use": "yes",
  "privacy": "local",
  "license": "GPL-3.0",
  "limits": "Performance depends on GPU and model selection.",
  "limits_fr": "Les performances dépendent du GPU et de la sélection du modèle.",
  "caveats": ["Steep learning curve for node-based workflows.", "Requires GPU with sufficient VRAM."],
  "caveats_fr": ["Courbe d'apprentissage raide pour les flux de travail basés sur des nœuds.", "Nécessite un GPU avec suffisamment de VRAM."],
  "tags": ["stable-diffusion", "image-generation", "node-based", "modular"],
  "source": {"url": "https://github.com/comfyanonymous/ComfyUI", "type": "official-repository", "official": true},
  "last_verified": "2026-08-04",
  "status": "active",
  "confidence": "high"
}