{
  "id": "streamlit",
  "name": "Streamlit",
  "description": "An open-source Python framework for building interactive data and AI applications with widgets, charts, caching, multipage layouts, and deployable web interfaces.",
  "description_fr": "Un framework Python open source pour créer des applications de données et d’IA interactives avec widgets, graphiques, cache, pages multiples et interfaces web.",
  "best_for": "Building polished Python AI apps quickly",
  "best_for_fr": "Créer rapidement des applications IA Python soignées",
  "category": "app-builder",
  "free_type": "open-source",
  "access": "hybrid",
  "difficulty": "beginner",
  "platforms": ["web", "windows", "macos", "linux", "docker"],
  "homepage": "https://github.com/streamlit/streamlit",
  "account_required": false,
  "card_required": false,
  "commercial_use": "yes",
  "privacy": "configurable",
  "license": "Apache-2.0",
  "limits": "The framework is free; compute, storage, model APIs, and hosting limits depend on where the application is deployed.",
  "limits_fr": "Le framework est gratuit; le calcul, le stockage, les API de modèles et les limites d’hébergement dépendent du déploiement.",
  "caveats": ["Production apps still need authentication, secrets management, and scaling design."],
  "caveats_fr": ["Les applications de production exigent authentification, gestion des secrets et conception de la mise à l’échelle."],
  "tags": ["python", "ui", "data-app", "web"],
  "source": {"url": "https://github.com/streamlit/streamlit", "type": "official-repository", "official": true},
  "last_verified": "2026-08-04",
  "status": "active",
  "confidence": "high"
}
