{
  "id": "dspy",
  "name": "DSPy",
  "description": "A framework for programming with foundation models that allows you to define modules and optimize prompts automatically.",
  "description_fr": "Un cadre pour programmer avec des modèles fondamentaux qui vous permet de définir des modules et d'optimiser les prompts automatiquement.",
  "best_for": "Programming and optimizing LLM pipelines",
  "best_for_fr": "Programmer et optimiser les pipelines LLM",
  "category": "rag",
  "free_type": "open-source",
  "access": "local",
  "difficulty": "advanced",
  "platforms": ["windows", "macos", "linux"],
  "homepage": "https://github.com/stanfordnlp/dspy",
  "account_required": false,
  "card_required": false,
  "commercial_use": "yes",
  "privacy": "local",
  "license": "MIT",
  "limits": "The framework is free; requires understanding of prompt optimization.",
  "limits_fr": "Le cadre est gratuit; nécessite une compréhension de l'optimisation des prompts.",
  "caveats": ["Complex optimization process.", "Requires understanding of DSPy concepts."],
  "caveats_fr": ["Processus d'optimisation complexe.", "Nécessite une compréhension des concepts DSPy."],
  "tags": ["optimization", "prompts", "programming", "stanford"],
  "source": {"url": "https://github.com/stanfordnlp/dspy", "type": "official-repository", "official": true},
  "last_verified": "2026-08-04",
  "status": "active",
  "confidence": "high"
}