{
  "id": "bark",
  "name": "Bark",
  "description": "A transformer-based text-to-audio model capable of generating highly realistic multilingual speech with non-verbal sounds.",
  "description_fr": "Un modèle de synthèse text-audio basé sur des transformateurs capable de générer de la parole multilingue très réaliste avec des sons non verbaux.",
  "best_for": "Realistic speech with non-verbal sounds",
  "best_for_fr": "Parole réaliste avec des sons non verbaux",
  "category": "speech",
  "free_type": "open-source",
  "access": "local",
  "difficulty": "intermediate",
  "platforms": ["windows", "macos", "linux"],
  "homepage": "https://github.com/suno-ai/bark",
  "account_required": false,
  "card_required": false,
  "commercial_use": "yes",
  "privacy": "local",
  "license": "MIT",
  "limits": "Requires GPU for optimal performance.",
  "limits_fr": "Nécessite un GPU pour des performances optimales.",
  "caveats": ["Requires GPU for optimal performance.", "Generation can be slow on CPU."],
  "caveats_fr": ["Nécessite un GPU pour des performances optimales.", "La génération peut être lente sur CPU."],
  "tags": ["speech", "tts", "realistic", "multilingual"],
  "source": {"url": "https://github.com/suno-ai/bark", "type": "official-repository", "official": true},
  "last_verified": "2026-08-04",
  "status": "active",
  "confidence": "high"
}