{
  "id": "langflow",
  "name": "Langflow",
  "description": "A visual framework for building multi-agent and RAG applications with a drag-and-drop interface and support for multiple LLM providers.",
  "description_fr": "Un cadre visuel pour construire des applications multi-agents et RAG avec une interface glisser-déposer et support pour plusieurs fournisseurs de LLM.",
  "best_for": "Building AI apps with visual workflow builder",
  "best_for_fr": "Construire des apps IA avec constructeur de flux de travail visuel",
  "category": "app-builder",
  "free_type": "open-source",
  "access": "local",
  "difficulty": "beginner",
  "platforms": ["windows", "macos", "linux", "docker"],
  "homepage": "https://github.com/langflow-ai/langflow",
  "account_required": false,
  "card_required": false,
  "commercial_use": "yes",
  "privacy": "local",
  "license": "MIT",
  "limits": "The framework is free; Langflow Cloud has separate pricing.",
  "limits_fr": "Le cadre est gratuit; Langflow Cloud a une tarification séparée.",
  "caveats": ["Complex applications may require coding.", "Cloud services have separate pricing."],
  "caveats_fr": ["Les applications complexes peuvent nécessiter du codage.", "Les services cloud ont une tarification séparée."],
  "tags": ["no-code", "visual", "rag", "agents"],
  "source": {"url": "https://github.com/langflow-ai/langflow", "type": "official-repository", "official": true},
  "last_verified": "2026-08-04",
  "status": "active",
  "confidence": "high"
}