{
  "id": "transformers",
  "name": "Transformers",
  "description": "A state-of-the-art machine learning library for PyTorch, TensorFlow, and JAX with thousands of pretrained models for text, image, audio, and more.",
  "description_fr": "Une bibliothèque d'apprentissage automatique de pointe pour PyTorch, TensorFlow et JAX avec des milliers de modèles pré-entraînés pour le texte, l'image, l'audio et plus.",
  "best_for": "Using pretrained models for NLP, vision, and audio",
  "best_for_fr": "Utiliser des modèles pré-entraînés pour le NLP, la vision et l'audio",
  "category": "ml-framework",
  "free_type": "open-source",
  "access": "local",
  "difficulty": "intermediate",
  "platforms": ["windows", "macos", "linux"],
  "homepage": "https://github.com/huggingface/transformers",
  "account_required": false,
  "card_required": false,
  "commercial_use": "yes",
  "privacy": "local",
  "license": "Apache-2.0",
  "limits": "The library is free; model licenses vary.",
  "limits_fr": "La bibliothèque est gratuite; les licences des modèles varient.",
  "caveats": ["Large library with complex API.", "Model licenses vary by model."],
  "caveats_fr": ["Grande bibliothèque avec API complexe.", "Les licences des modèles varient selon le modèle."],
  "tags": ["ml", "nlp", "vision", "audio", "pretrained"],
  "source": {"url": "https://github.com/huggingface/transformers", "type": "official-repository", "official": true},
  "last_verified": "2026-08-04",
  "status": "active",
  "confidence": "high"
}