{
  "id": "faiss",
  "name": "Faiss",
  "description": "An open-source library for efficient similarity search and clustering of dense vectors, with multiple indexes and CPU or GPU implementations.",
  "description_fr": "Une bibliothèque open source pour la recherche efficace par similarité et le regroupement de vecteurs denses, avec plusieurs index et versions CPU ou GPU.",
  "best_for": "In-process vector search and research experiments",
  "best_for_fr": "La recherche vectorielle intégrée et les expériences de recherche",
  "category": "vector-database",
  "free_type": "open-source",
  "access": "local",
  "difficulty": "advanced",
  "platforms": ["windows", "macos", "linux"],
  "homepage": "https://github.com/facebookresearch/faiss",
  "account_required": false,
  "card_required": false,
  "commercial_use": "yes",
  "privacy": "local",
  "license": "MIT",
  "limits": "Faiss is a library rather than a full database; persistence, metadata, access control, replication, and serving must be built separately.",
  "limits_fr": "Faiss est une bibliothèque plutôt qu’une base complète; persistance, métadonnées, accès, réplication et service doivent être construits séparément.",
  "caveats": ["Index accuracy, memory, and speed require explicit tuning.", "GPU support depends on compatible CUDA hardware."],
  "caveats_fr": ["Précision, mémoire et vitesse des index exigent un réglage explicite.", "Le GPU dépend de matériel CUDA compatible."],
  "tags": ["vector", "search", "library", "gpu"],
  "source": {"url": "https://github.com/facebookresearch/faiss", "type": "official-repository", "official": true},
  "last_verified": "2026-08-04",
  "status": "active",
  "confidence": "high"
}
