{
  "id": "langchain",
  "name": "LangChain",
  "description": "An open-source framework for building agent and language-model applications with tools, retrieval, structured outputs, integrations, and reusable components.",
  "description_fr": "Un framework open source pour créer des applications de modèles et d’agents avec outils, recherche, sorties structurées, intégrations et composants réutilisables.",
  "best_for": "Composable Python agent and LLM applications",
  "best_for_fr": "Les applications Python d’agents et de LLM composables",
  "category": "agents",
  "free_type": "open-source",
  "access": "hybrid",
  "difficulty": "intermediate",
  "platforms": ["windows", "macos", "linux", "docker"],
  "homepage": "https://github.com/langchain-ai/langchain",
  "account_required": false,
  "card_required": false,
  "commercial_use": "depends",
  "privacy": "configurable",
  "license": "MIT",
  "limits": "The framework is free; connected models, data stores, tracing services, and deployment infrastructure may have separate costs and terms.",
  "limits_fr": "Le framework est gratuit; les modèles, bases, services de traçage et infrastructures connectés peuvent avoir leurs propres coûts et conditions.",
  "caveats": ["Complex applications still need evaluation and observability.", "Integration licenses and provider terms vary."],
  "caveats_fr": ["Les applications complexes exigent toujours évaluation et observabilité.", "Les licences d’intégration et conditions des fournisseurs varient."],
  "tags": ["agents", "llm", "python", "rag"],
  "source": {"url": "https://github.com/langchain-ai/langchain", "type": "official-repository", "official": true},
  "last_verified": "2026-08-04",
  "status": "active",
  "confidence": "high"
}
