{
  "id": "vllm",
  "name": "vLLM",
  "description": "A high-throughput, memory-efficient inference and serving engine for language models, with an OpenAI-compatible API and production-oriented batching.",
  "description_fr": "Un moteur d’inférence et de service à haut débit pour modèles de langage, avec API compatible OpenAI et traitement en lots orienté production.",
  "best_for": "Serving open models efficiently on GPUs",
  "best_for_fr": "Servir efficacement des modèles ouverts sur GPU",
  "category": "inference-server",
  "free_type": "open-source",
  "access": "local",
  "difficulty": "advanced",
  "platforms": ["linux", "docker"],
  "homepage": "https://github.com/vllm-project/vllm",
  "account_required": false,
  "card_required": false,
  "commercial_use": "yes",
  "privacy": "local",
  "license": "Apache-2.0",
  "limits": "Practical use usually requires a compatible accelerator, sufficient VRAM, and careful model-specific configuration.",
  "limits_fr": "L’usage pratique exige généralement un accélérateur compatible, assez de VRAM et une configuration adaptée au modèle.",
  "caveats": ["The engine license and the served model license are separate."],
  "caveats_fr": ["La licence du moteur et celle du modèle servi sont distinctes."],
  "tags": ["llm", "serving", "gpu", "openai-compatible"],
  "source": {"url": "https://github.com/vllm-project/vllm", "type": "official-repository", "official": true},
  "last_verified": "2026-08-04",
  "status": "active",
  "confidence": "high"
}
