{
  "id": "fastai-course",
  "name": "Practical Deep Learning for Coders",
  "description": "A free, example-first deep-learning course for people with coding experience, covering vision, NLP, tabular data, deployment, foundations, and diffusion.",
  "description_fr": "Un cours gratuit et pratique de deep learning pour les personnes qui codent, couvrant vision, NLP, données tabulaires, déploiement, fondations et diffusion.",
  "best_for": "Learning practical deep learning by building",
  "best_for_fr": "Apprendre le deep learning pratique en construisant",
  "category": "learning",
  "free_type": "free-tier",
  "access": "cloud",
  "difficulty": "intermediate",
  "platforms": [
    "web"
  ],
  "homepage": "https://course.fast.ai/",
  "account_required": false,
  "card_required": false,
  "commercial_use": "depends",
  "privacy": "provider-processed",
  "license": null,
  "limits": "Course material is free; hands-on work uses local or third-party notebook compute with its own limits.",
  "limits_fr": "Le matériel du cours est gratuit; les exercices utilisent du calcul local ou des notebooks tiers avec leurs propres limites.",
  "caveats": [
    "The course expects coding experience, preferably Python, and basic high-school mathematics."
  ],
  "caveats_fr": [
    "Le cours demande de l’expérience en programmation, idéalement Python, et les mathématiques du secondaire."
  ],
  "tags": [
    "course",
    "deep-learning",
    "python",
    "diffusion"
  ],
  "source": {
    "url": "https://course.fast.ai/",
    "type": "official-docs",
    "official": true
  },
  "last_verified": "2026-09-26",
  "status": "active",
  "confidence": "high"
}
